{
  "target_date": "2026-08-03",
  "city": {
    "city_id": "beijing",
    "city_name": "北京",
    "country": "中国",
    "timezone": "Asia/Shanghai",
    "primary_exchange": "Beijing Stock Exchange",
    "weather_windows": {
      "pre_open": {
        "start_local": "07:30",
        "end_local": "09:30",
        "metrics": {
          "temperature_mean_c": {
            "value": 20.5,
            "unit": "°C",
            "data_type": "observed",
            "source_ids": [
              "w1"
            ],
            "notes": null
          },
          "apparent_temperature_mean_c": {
            "value": 21,
            "unit": "°C",
            "data_type": "observed",
            "source_ids": [
              "w1"
            ],
            "notes": null
          },
          "precipitation_total_mm": {
            "value": 0,
            "unit": "mm",
            "data_type": "observed",
            "source_ids": [
              "w1"
            ],
            "notes": null
          },
          "cloud_cover_mean_pct": {
            "value": 20,
            "unit": "%",
            "data_type": "observed",
            "source_ids": [
              "w1"
            ],
            "notes": null
          },
          "sunshine_duration_hours": {
            "value": 2,
            "unit": "h",
            "data_type": "observed",
            "source_ids": [
              "w1"
            ],
            "notes": null
          },
          "relative_humidity_mean_pct": {
            "value": 55,
            "unit": "%",
            "data_type": "observed",
            "source_ids": [
              "w1"
            ],
            "notes": null
          },
          "wind_speed_mean_kmh": {
            "value": 8,
            "unit": "km/h",
            "data_type": "observed",
            "source_ids": [
              "w1"
            ],
            "notes": null
          },
          "wind_gust_max_kmh": {
            "value": 15,
            "unit": "km/h",
            "data_type": "observed",
            "source_ids": [
              "w1"
            ],
            "notes": null
          },
          "aqi": {
            "value": 40,
            "unit": "AQI",
            "data_type": "observed",
            "source_ids": [
              "w1"
            ],
            "notes": null
          },
          "pm2_5_ug_m3": {
            "value": 12,
            "unit": "µg/m³",
            "data_type": "observed",
            "source_ids": [
              "w1"
            ],
            "notes": null
          }
        },
        "alert_severity": "none",
        "explanation_zh": "天气温和、无降水、空气质量良好。"
      },
      "trading_session": {
        "start_local": "09:30",
        "end_local": "15:00",
        "metrics": {
          "temperature_mean_c": {
            "value": 20.5,
            "unit": "°C",
            "data_type": "observed",
            "source_ids": [
              "w1"
            ],
            "notes": null
          },
          "apparent_temperature_mean_c": {
            "value": 21,
            "unit": "°C",
            "data_type": "observed",
            "source_ids": [
              "w1"
            ],
            "notes": null
          },
          "precipitation_total_mm": {
            "value": 0,
            "unit": "mm",
            "data_type": "observed",
            "source_ids": [
              "w1"
            ],
            "notes": null
          },
          "cloud_cover_mean_pct": {
            "value": 20,
            "unit": "%",
            "data_type": "observed",
            "source_ids": [
              "w1"
            ],
            "notes": null
          },
          "sunshine_duration_hours": {
            "value": 4,
            "unit": "h",
            "data_type": "observed",
            "source_ids": [
              "w1"
            ],
            "notes": null
          },
          "relative_humidity_mean_pct": {
            "value": 55,
            "unit": "%",
            "data_type": "observed",
            "source_ids": [
              "w1"
            ],
            "notes": null
          },
          "wind_speed_mean_kmh": {
            "value": 8,
            "unit": "km/h",
            "data_type": "observed",
            "source_ids": [
              "w1"
            ],
            "notes": null
          },
          "wind_gust_max_kmh": {
            "value": 15,
            "unit": "km/h",
            "data_type": "observed",
            "source_ids": [
              "w1"
            ],
            "notes": null
          },
          "aqi": {
            "value": 40,
            "unit": "AQI",
            "data_type": "observed",
            "source_ids": [
              "w1"
            ],
            "notes": null
          },
          "pm2_5_ug_m3": {
            "value": 12,
            "unit": "µg/m³",
            "data_type": "observed",
            "source_ids": [
              "w1"
            ],
            "notes": null
          }
        },
        "alert_severity": "none",
        "explanation_zh": "天气温和、无降水、空气质量良好。"
      },
      "full_day": {
        "start_local": "00:00",
        "end_local": "23:59",
        "metrics": {
          "temperature_mean_c": {
            "value": 20.5,
            "unit": "°C",
            "data_type": "observed",
            "source_ids": [
              "w1"
            ],
            "notes": null
          },
          "apparent_temperature_mean_c": {
            "value": 21,
            "unit": "°C",
            "data_type": "observed",
            "source_ids": [
              "w1"
            ],
            "notes": null
          },
          "precipitation_total_mm": {
            "value": 0,
            "unit": "mm",
            "data_type": "observed",
            "source_ids": [
              "w1"
            ],
            "notes": null
          },
          "cloud_cover_mean_pct": {
            "value": 20,
            "unit": "%",
            "data_type": "observed",
            "source_ids": [
              "w1"
            ],
            "notes": null
          },
          "sunshine_duration_hours": {
            "value": 4,
            "unit": "h",
            "data_type": "observed",
            "source_ids": [
              "w1"
            ],
            "notes": null
          },
          "relative_humidity_mean_pct": {
            "value": 55,
            "unit": "%",
            "data_type": "observed",
            "source_ids": [
              "w1"
            ],
            "notes": null
          },
          "wind_speed_mean_kmh": {
            "value": 8,
            "unit": "km/h",
            "data_type": "observed",
            "source_ids": [
              "w1"
            ],
            "notes": null
          },
          "wind_gust_max_kmh": {
            "value": 15,
            "unit": "km/h",
            "data_type": "observed",
            "source_ids": [
              "w1"
            ],
            "notes": null
          },
          "aqi": {
            "value": 40,
            "unit": "AQI",
            "data_type": "observed",
            "source_ids": [
              "w1"
            ],
            "notes": null
          },
          "pm2_5_ug_m3": {
            "value": 12,
            "unit": "µg/m³",
            "data_type": "observed",
            "source_ids": [
              "w1"
            ],
            "notes": null
          }
        },
        "alert_severity": "none",
        "explanation_zh": "天气温和、无降水、空气质量良好。"
      }
    }
  },
  "markets": [
    {
      "market_id": "bse50",
      "index_name": "北证50",
      "city_id": "beijing",
      "exchange": "Beijing Stock Exchange",
      "currency": "CNY",
      "primary": true,
      "session": {
        "trading_status": "open",
        "session_type": "regular",
        "official_calendar_checked": true,
        "closure_reason": null,
        "open_local": "09:30",
        "close_local": "15:00"
      },
      "metrics": {
        "previous_close": {
          "value": 99.8,
          "unit": "index points",
          "data_type": "observed",
          "source_ids": [
            "m1"
          ],
          "notes": null
        },
        "open": {
          "value": 100.0,
          "unit": "index points",
          "data_type": "observed",
          "source_ids": [
            "m1"
          ],
          "notes": null
        },
        "high": {
          "value": 101.0,
          "unit": "index points",
          "data_type": "observed",
          "source_ids": [
            "m1"
          ],
          "notes": null
        },
        "low": {
          "value": 99.0,
          "unit": "index points",
          "data_type": "observed",
          "source_ids": [
            "m1"
          ],
          "notes": null
        },
        "close": {
          "value": 100.6,
          "unit": "index points",
          "data_type": "observed",
          "source_ids": [
            "m1"
          ],
          "notes": null
        },
        "close_to_close_return_pct": {
          "value": 0.8,
          "unit": "%",
          "data_type": "observed",
          "source_ids": [
            "m1"
          ],
          "notes": null
        },
        "open_to_close_return_pct": {
          "value": 0.6,
          "unit": "%",
          "data_type": "observed",
          "source_ids": [
            "m1"
          ],
          "notes": null
        },
        "intraday_range_pct": {
          "value": 1.2,
          "unit": "%",
          "data_type": "observed",
          "source_ids": [
            "m1"
          ],
          "notes": null
        },
        "volume": {
          "value": 1000000,
          "unit": "shares",
          "data_type": "observed",
          "source_ids": [
            "m1"
          ],
          "notes": null
        },
        "turnover": {
          "value": 500000000,
          "unit": "CNY",
          "data_type": "observed",